cleansing,CaseFolding
Belanja sopee pernah kecewa barang nya pernah gagal banyak diskon lagi pengirimanya juga cepat terima kasih sopee,belanja sopee pernah kecewa barang nya pernah gagal banyak diskon lagi pengirimanya juga cepat terima kasih sopee
Shopee adalah salah satu apk belanja online andalan saya  Dalam sebulan saya berbelanja kali dgn menggunakan aplikasi shopee dan saya tdk pernah kecewa ketika berbelanja online  Masukkan buat apk ini tolong voucher gratis ongkirnya di perbanyak lge Karna pihak pembeli sangat berat menanggung ongkir yg ditetapkan oleh pihak shopee Jika voucher gratis ongkir di kurangi ditiadakan lge oleh pihak shopee setidaknya harganya harga ongkir yg ditetapkan tidak lebih besar dari pada harga barang,shopee adalah salah satu apk belanja online andalan saya  dalam sebulan saya berbelanja kali dgn menggunakan aplikasi shopee dan saya tdk pernah kecewa ketika berbelanja online  masukkan buat apk ini tolong voucher gratis ongkirnya di perbanyak lge karna pihak pembeli sangat berat menanggung ongkir yg ditetapkan oleh pihak shopee jika voucher gratis ongkir di kurangi ditiadakan lge oleh pihak shopee setidaknya harganya harga ongkir yg ditetapkan tidak lebih besar dari pada harga barang
Pesanan cepat dan tepat waktu serta kualitas barang yg baik bravo shopee,pesanan cepat dan tepat waktu serta kualitas barang yg baik bravo shopee
Terima kasih buat shopee yang sangat membantu sekali dalam urusan berbelanja untuk kebutuhan keluarga dan Aplikasi yg sangat bagus dan sangat respon banget dengan keluhan konsumen nya Semoga kedepannya lebih baik dan sukses terus shopee Mantaap Oke bangeett,terima kasih buat shopee yang sangat membantu sekali dalam urusan berbelanja untuk kebutuhan keluarga dan aplikasi yg sangat bagus dan sangat respon banget dengan keluhan konsumen nya semoga kedepannya lebih baik dan sukses terus shopee mantaap oke bangeett
Buat tim shopee  tolong di buat varian berat nya masa varian berat barang nya gak bisa di rubah untuk varian harga tidak masalah  Kasihan buat pembeli tolong dibantu Terimakasih Salam hangat buat tim shopee dari penjual By orangbogorselaluramah,buat tim shopee  tolong di buat varian berat nya masa varian berat barang nya gak bisa di rubah untuk varian harga tidak masalah  kasihan buat pembeli tolong dibantu terimakasih salam hangat buat tim shopee dari penjual by orangbogorselaluramah
Selalu suka belanja disini  asalkan pintar  cari barang direseller pasti selalu dpt barang bagus sesuai diskripsi,selalu suka belanja disini  asalkan pintar  cari barang direseller pasti selalu dpt barang bagus sesuai diskripsi
Perbanyak gratis ongkir lagi trima kasih shoppe aplikasi paling rekomended untuk persoalan belanja online,perbanyak gratis ongkir lagi trima kasih shoppe aplikasi paling rekomended untuk persoalan belanja online
ecommers pertama yg saya pakai  dari dulu sampai sekarang paling nyaman pakai shopee  mudah digunakan juga,ecommers pertama yg saya pakai  dari dulu sampai sekarang paling nyaman pakai shopee  mudah digunakan juga
Mau tanya dong  kenapa di shopee aku  setiap kali kasih penilaian  bintang nya gak bisa muncul ya Jadi kalo mau kasih penilaian  si bintang itu gak bisa kelihatan  Padahal udah perbaharui aplikasi  hapus cache shopee hasilnya tetep sama  SEMOGA DI JAWABAN DEH  ,mau tanya dong  kenapa di shopee aku  setiap kali kasih penilaian  bintang nya gak bisa muncul ya jadi kalo mau kasih penilaian  si bintang itu gak bisa kelihatan  padahal udah perbaharui aplikasi  hapus cache shopee hasilnya tetep sama  semoga di jawaban deh  
Pesan barang selalu  sesuai gambar harga terjangkau  dan cepat pengiriman nya,pesan barang selalu  sesuai gambar harga terjangkau  dan cepat pengiriman nya
Shoppe the best deh banyak gratis ongkir trs ad cash back ny lagii belanja online jadi lebih mudah dan menguntung kan,shoppe the best deh banyak gratis ongkir trs ad cash back ny lagii belanja online jadi lebih mudah dan menguntung kan
Belanja gampang  Ada subsidi ongkir  Alhamdulillah puas pertahankan shopee,belanja gampang  ada subsidi ongkir  alhamdulillah puas pertahankan shopee
Sdh berulang kali saya blanja online lwt Shopee  Alhamdulillah selalu amanah Terimakasih Shopee  moga mkin hari makin berkwalitas dlm melayani pelanggannya,sdh berulang kali saya blanja online lwt shopee  alhamdulillah selalu amanah terimakasih shopee  moga mkin hari makin berkwalitas dlm melayani pelanggannya
Membantu banget buat yang seneng belanja online  menu menunya mudah dipahami  Tapi kalau lamar kerja di shopee agak susah tesnya nh  Gagal melulu kalo lamar di shopee udah gagal kali  Mudah mudahan nanti ada kesempatan bisa lamar shopee saya bisa lolos amin,membantu banget buat yang seneng belanja online  menu menunya mudah dipahami  tapi kalau lamar kerja di shopee agak susah tesnya nh  gagal melulu kalo lamar di shopee udah gagal kali  mudah mudahan nanti ada kesempatan bisa lamar shopee saya bisa lolos amin
Aplikasi sangat berguna untuk semua kalangan untuk belanja online Terima kasih shopee semoga makin sukses,aplikasi sangat berguna untuk semua kalangan untuk belanja online terima kasih shopee semoga makin sukses
Puas belanja shopee banyak koin gratis  bebas ongkir juga  wah mantep abis pokonya sukses terus buat shopee pokonya ,puas belanja shopee banyak koin gratis  bebas ongkir juga  wah mantep abis pokonya sukses terus buat shopee pokonya 
Apknya bagus banget Tapi banyakin dong vocer gratis ongkirnya tapi untuk yang bukan pengguna shopee pay karna saya setiap mau beli barang ongkirnya lebih besar di banding harga produknya Sekian terimakasi  ,apknya bagus banget tapi banyakin dong vocer gratis ongkirnya tapi untuk yang bukan pengguna shopee pay karna saya setiap mau beli barang ongkirnya lebih besar di banding harga produknya sekian terimakasi  
Diantara online marketing Shopee memang pilihan yang tepat dan terpecaya dan puas atas pelayananya,diantara online marketing shopee memang pilihan yang tepat dan terpecaya dan puas atas pelayananya
shoope produk  nya sangat memuaskan bangeet tempat belanja online terpercaya nomer di indonesia,shoope produk  nya sangat memuaskan bangeet tempat belanja online terpercaya nomer di indonesia
Banyak point ny aplikasi gampang digunakan baik untuk jualan dan sekedar belanja,banyak point ny aplikasi gampang digunakan baik untuk jualan dan sekedar belanja
kualitas penjual lebih bagus di shopee barang yg dikirim selallu sesuai dengan foto dan aku pindah beli online di shopee aj,kualitas penjual lebih bagus di shopee barang yg dikirim selallu sesuai dengan foto dan aku pindah beli online di shopee aj
Pelayanan shope keren banyak promo dan free ongkir  Semoga para resellernya juga tidak mengecewakan,pelayanan shope keren banyak promo dan free ongkir  semoga para resellernya juga tidak mengecewakan
Proses mudah  aman  ada ribuan seller dg berbagai produk sesuai yg kita inginkan,proses mudah  aman  ada ribuan seller dg berbagai produk sesuai yg kita inginkan
Suka Kalau blnja psti realpick,suka kalau blnja psti realpick
Dengan menggunakan aplikasi shopee belanja lebih mudah dan menyenangkan selain itu hrga nya jg terjangkau,dengan menggunakan aplikasi shopee belanja lebih mudah dan menyenangkan selain itu hrga nya jg terjangkau
Kalo bisa kerja sama dengan lionparcel juga biar pengirimannya lebih cepat buat kami di wilayah NTT,kalo bisa kerja sama dengan lionparcel juga biar pengirimannya lebih cepat buat kami di wilayah ntt
Puas banget belanja Shopee  bnyk gratis ongkir dr rp ampe minim belanja rp  rb  aq udh berkali kali order via shopee tetep puas trz  Gomawo Shopee,puas banget belanja shopee  bnyk gratis ongkir dr rp ampe minim belanja rp  rb  aq udh berkali kali order via shopee tetep puas trz  gomawo shopee
Shoope membantu banget pada orang yang membutuhkan barang tapi mager tinggal pencet aja barang nya dateng sendiri bisa COD lagi dan gratis ongkir untuk pengguna baru pokok nya sipp banget deh,shoope membantu banget pada orang yang membutuhkan barang tapi mager tinggal pencet aja barang nya dateng sendiri bisa cod lagi dan gratis ongkir untuk pengguna baru pokok nya sipp banget deh
Baru mulai jualan sdh banyak yg respon baik harga maupun ongkirnya  sipp kualitas barang lebih oke ya,baru mulai jualan sdh banyak yg respon baik harga maupun ongkirnya  sipp kualitas barang lebih oke ya
Kualitas aplikasi Nya kelihatan di dunia ini yang mau orang yang tidak bisa nga kau dapat hidup di dunia ini yang mau orang orang mna yg di buat oleh karena itu ia juga tidak bisa di hapus semua pelajaran bahasa Indonesia di mata masyarakat Indonesia khususnya remaja yang memiliki nilai ekonomis untuk interview with the iron man dan yang paling banyak digunakan oleh para ahli di bidang pendidikan di Indonesia di mata masyarakat Indonesia yang di jual dari ribuan toko online di Indonesia di mata,kualitas aplikasi nya kelihatan di dunia ini yang mau orang yang tidak bisa nga kau dapat hidup di dunia ini yang mau orang orang mna yg di buat oleh karena itu ia juga tidak bisa di hapus semua pelajaran bahasa indonesia di mata masyarakat indonesia khususnya remaja yang memiliki nilai ekonomis untuk interview with the iron man dan yang paling banyak digunakan oleh para ahli di bidang pendidikan di indonesia di mata masyarakat indonesia yang di jual dari ribuan toko online di indonesia di mata
Shopee mantap tapi belum bisa membantu menambah limit pinjmaman  Padahal saya sudah berusaha,shopee mantap tapi belum bisa membantu menambah limit pinjmaman  padahal saya sudah berusaha
Alhamdulillah  bener bener gak bisa berhenti bersyukur saya  rejeki dari Allah diperantarakan lewat shopee  shopee sngat membantu skali dlam perokonomian saya  Alhamdulillah Alhamdulillahhirtobbil alamin pokoknya  the bestlah shopee  SEMOGA slalu sukses  dan mengayomi rakyat kecil sperti saya  makasih shopee maksih skali sudah mempermudah saya dlam perokonomian,alhamdulillah  bener bener gak bisa berhenti bersyukur saya  rejeki dari allah diperantarakan lewat shopee  shopee sngat membantu skali dlam perokonomian saya  alhamdulillah alhamdulillahhirtobbil alamin pokoknya  the bestlah shopee  semoga slalu sukses  dan mengayomi rakyat kecil sperti saya  makasih shopee maksih skali sudah mempermudah saya dlam perokonomian
Pengalaman belanja yang sangat menyenangkan  selain dapat produk yang kita cari  kita juga dapat koin shopee dan juga voucher voucher lainnya  Ada gamenya juga lho untuk mendapatkan koin dan voucher  wah mantap sekali  buruan yg belum download  Instal sekarang apk ini banyak keuntungan yg kita dapat Happy shopping,pengalaman belanja yang sangat menyenangkan  selain dapat produk yang kita cari  kita juga dapat koin shopee dan juga voucher voucher lainnya  ada gamenya juga lho untuk mendapatkan koin dan voucher  wah mantap sekali  buruan yg belum download  instal sekarang apk ini banyak keuntungan yg kita dapat happy shopping
Terima kasih shopee aplikasi ini sangat bagus bisa gratis ongkir extra dan bayar ditempat  cod,terima kasih shopee aplikasi ini sangat bagus bisa gratis ongkir extra dan bayar ditempat  cod
Kenapa shopee candy saya ga bisa kebuka ya  terhenti di level barangkali as da solusi nya,kenapa shopee candy saya ga bisa kebuka ya  terhenti di level barangkali as da solusi nya
Sesuai janjiku padamu Shoppe Layak dpt bintang Shoppe cepat tanggap dlm membantu Penyelesaian Mslh antara buyer & Seller good job ,sesuai janjiku padamu shoppe layak dpt bintang shoppe cepat tanggap dlm membantu penyelesaian mslh antara buyer & seller good job 
Aplikasi belanja mudah segala sesuatu kebutuhan ada  penjual pada ramah dan pelayananya cepat,aplikasi belanja mudah segala sesuatu kebutuhan ada  penjual pada ramah dan pelayananya cepat
Awal dulu prnh kecewa myungkin Krn blum tau sela cari toko yg amanah berkualitas  Tp kedua kali smp skrg Alhamdulillah gk prnh kecewa barang selalu sesuai deskripsi  Udah tahun lbh langganan shopee,awal dulu prnh kecewa myungkin krn blum tau sela cari toko yg amanah berkualitas  tp kedua kali smp skrg alhamdulillah gk prnh kecewa barang selalu sesuai deskripsi  udah tahun lbh langganan shopee
Sangat senang menggunakan aplikasi jual beli ini terimakasih banyak untuk pembuat aplikasi ini pokoknya suka sekali,sangat senang menggunakan aplikasi jual beli ini terimakasih banyak untuk pembuat aplikasi ini pokoknya suka sekali
Aplikasinya isinya pada nuntut spaylater sama pinjaman online  Aku saja gak di pakai spaylater dan pinjamannya ,aplikasinya isinya pada nuntut spaylater sama pinjaman online  aku saja gak di pakai spaylater dan pinjamannya 
Suka blj di shopee krn barangnya bagus  dan harga lebih murah dan bergaransi lagi penjual gak kirim brg pesanan otomatis dibatalkan dan uang kembalu,suka blj di shopee krn barangnya bagus  dan harga lebih murah dan bergaransi lagi penjual gak kirim brg pesanan otomatis dibatalkan dan uang kembalu
Sy pelanggan setia shopee tdk pindah kelain hati maju terus utk shopee kpn saya bisa dpt doorprize dari shopee ya,sy pelanggan setia shopee tdk pindah kelain hati maju terus utk shopee kpn saya bisa dpt doorprize dari shopee ya
Suka banget sama shoppe bisa mempermudah belanja bisa memilih harganya setiap toko mksh shoppe sering  promo ya,suka banget sama shoppe bisa mempermudah belanja bisa memilih harganya setiap toko mksh shoppe sering  promo ya
Semua fitur bagus  banyakin naikkan lagi saja cash back nya wahai shopee  Biar makin sering belanja  Terima kasih,semua fitur bagus  banyakin naikkan lagi saja cash back nya wahai shopee  biar makin sering belanja  terima kasih
Sya mau coba shopee food di apk shopee tp knp ga ada ya  mohon bantuannya Tks,sya mau coba shopee food di apk shopee tp knp ga ada ya  mohon bantuannya tks
Kenapa sekarang gx da potongan ongkir ya untuk luar jawa  biasanya ada potongan ongkir sekarang gx ada,kenapa sekarang gx da potongan ongkir ya untuk luar jawa  biasanya ada potongan ongkir sekarang gx ada
Fastrespon sekali pengalaman pernah bermasalah sama jasa pengiriman tpi alhamdulillah barangnya ketemu,fastrespon sekali pengalaman pernah bermasalah sama jasa pengiriman tpi alhamdulillah barangnya ketemu
Koin makin pelit  Makin memburuk saja  Kesempatan dapatkan koin menipis  Game goyang sudah tidak ada  game tangkap hri cm main  Jelek amat skarang  Cashback susah didpat  tapi utk aplikasi ini ok  Tingkatkan ajj gamenya ya,koin makin pelit  makin memburuk saja  kesempatan dapatkan koin menipis  game goyang sudah tidak ada  game tangkap hri cm main  jelek amat skarang  cashback susah didpat  tapi utk aplikasi ini ok  tingkatkan ajj gamenya ya
Aplikasi Belanja Daring yang sangat bersaing ditambah lagi ada PayLeter makin mantap aja,aplikasi belanja daring yang sangat bersaing ditambah lagi ada payleter makin mantap aja
Memuaskan belanja di shopee  dan sekarang ada fitur chekout lgsung gratis ongkir  Bayar pake shopeepay ya ,memuaskan belanja di shopee  dan sekarang ada fitur chekout lgsung gratis ongkir  bayar pake shopeepay ya 
Tolong Resto yg kerja sama dengan shoope food taro titik nya lebih jelas soalnya kendala di lapangan Soalnya driver hanya ikutin MAP shopee,tolong resto yg kerja sama dengan shoope food taro titik nya lebih jelas soalnya kendala di lapangan soalnya driver hanya ikutin map shopee
Saya sangat suka sekali soalnya barang barang nya bagus dan pengiriman nya juga cepat terima kasih shoope,saya sangat suka sekali soalnya barang barang nya bagus dan pengiriman nya juga cepat terima kasih shoope
Mantao apk nya ga ngecewain klo belanja di sini dari thn sampe sekarang selalu blanja di sini ajib,mantao apk nya ga ngecewain klo belanja di sini dari thn sampe sekarang selalu blanja di sini ajib
Sangat bagus saya sangat berpengalaman di aplikasi ini ayo download jangan ragu  untuk mendownload,sangat bagus saya sangat berpengalaman di aplikasi ini ayo download jangan ragu  untuk mendownload
Pengiriman tepat waktu  barang no tipu  kurirnya ramah baik pula terimakasih shoppe,pengiriman tepat waktu  barang no tipu  kurirnya ramah baik pula terimakasih shoppe
Sungguh sangat membantu untuk para pengusaha rumahan yg baru merintis bisnis terimakasih shopee,sungguh sangat membantu untuk para pengusaha rumahan yg baru merintis bisnis terimakasih shopee
Terimakasih Shopee Mantap jiwa banyak cashback dan gratis ongkir nya sukses selalu,terimakasih shopee mantap jiwa banyak cashback dan gratis ongkir nya sukses selalu
Shopiee sangat membantuku dalam berbelanja apalagi dimasa pandemi ini tingkatkan terus pelayannya agar lebih memuaskan konsumen sukses buat shopiee,shopiee sangat membantuku dalam berbelanja apalagi dimasa pandemi ini tingkatkan terus pelayannya agar lebih memuaskan konsumen sukses buat shopiee
bagus aplikasi belanja online yang sangat membantu saya dalam belanja online sehari hari,bagus aplikasi belanja online yang sangat membantu saya dalam belanja online sehari hari
Bagus banget ini aplikasi nya saya suka aplikasi nya rame lagi bisa main games saya kasih bintang lima deh,bagus banget ini aplikasi nya saya suka aplikasi nya rame lagi bisa main games saya kasih bintang lima deh
Aa bagus banget gak sia sia download dan belanja di shoope pelayanan nya bagus aplikasi nya bagus top deh kalau shoppe,aa bagus banget gak sia sia download dan belanja di shoope pelayanan nya bagus aplikasi nya bagus top deh kalau shoppe
Aku kasih bintang deh mudah mudahan cepet dapet spaylater jadi biar tambah semangat belanja nya,aku kasih bintang deh mudah mudahan cepet dapet spaylater jadi biar tambah semangat belanja nya
Belanja di shopee aman dan nyaman  Dana kita ga bakalan raib jk pesanan yg kita terima ga sesuai  Jgn lupa sll baca review  nya dl dan klik lepas dana stlh yakin pesanan yg kita terima sdh baik  aja  ga ada masalah  Jk review bagus  penjualnya biasanya baik dan kooperatif  Selama berbelanja dg shoppe sll merasa nyaman  Semoga yg baik tetap terjaga  dan yg krg menjadi baik ya,belanja di shopee aman dan nyaman  dana kita ga bakalan raib jk pesanan yg kita terima ga sesuai  jgn lupa sll baca review  nya dl dan klik lepas dana stlh yakin pesanan yg kita terima sdh baik  aja  ga ada masalah  jk review bagus  penjualnya biasanya baik dan kooperatif  selama berbelanja dg shoppe sll merasa nyaman  semoga yg baik tetap terjaga  dan yg krg menjadi baik ya
Banyak discount voucher  promo dan games nya rekomen marketplace ,banyak discount voucher  promo dan games nya rekomen marketplace 
Saya selalu belanja di Shopee Kualitas barang terjamin  Harga juga bersaing,saya selalu belanja di shopee kualitas barang terjamin  harga juga bersaing
lebih tingkatkan lagi fitur di shopee ke semua orang  jangan hanya orang yg terpilih the best lah,lebih tingkatkan lagi fitur di shopee ke semua orang  jangan hanya orang yg terpilih the best lah
Apl belanja online yg bagus  tingkatkan lagi biar gambar dan barang serta spepikasi barang sesuai,apl belanja online yg bagus  tingkatkan lagi biar gambar dan barang serta spepikasi barang sesuai
Bagus banget apk nya buat belanja dan berguna banget yabg jarang keluar rumah aku saranin buat download apk ini maksi,bagus banget apk nya buat belanja dan berguna banget yabg jarang keluar rumah aku saranin buat download apk ini maksi
Semakin nyaman belanja dishopee respon cepat pengiriman cepat  utama tuk pengembalian barang lbh mudah dibanding dengan toko sebelah pastinya kami semakin nyaman dan puas dan pengen terus dan terus belanja segala kebutuhan di shope SHOPEE IS THE BEST,semakin nyaman belanja dishopee respon cepat pengiriman cepat  utama tuk pengembalian barang lbh mudah dibanding dengan toko sebelah pastinya kami semakin nyaman dan puas dan pengen terus dan terus belanja segala kebutuhan di shope shopee is the best
Sejauh ini puas dengan pelayanan shopee  khususnya untuk gratis ongkirnya  Terimakasih shopee,sejauh ini puas dengan pelayanan shopee  khususnya untuk gratis ongkirnya  terimakasih shopee
Selalu langganan dengan shopee semoga bisa lebih banyak lagi bonus dan voucher diskon nya yah ehhehee,selalu langganan dengan shopee semoga bisa lebih banyak lagi bonus dan voucher diskon nya yah ehhehee
mantap  shopee adminya pengen di gebugin kali sama gua  untung gua orgnya sabaran  kalo ngga sabar udah gua bakar tuh adminya,mantap  shopee adminya pengen di gebugin kali sama gua  untung gua orgnya sabaran  kalo ngga sabar udah gua bakar tuh adminya
Terimakasih shoope aplikasi terperca se indonesia saya sudah kali memesa di shoope dan saya tidak perna kecewa saya telah memesan sprei sepatu pembatas buku  jas  sepatu sneakers perhiasan dll Saya sangat senang kurirnya ramah bisa Free ongkir dan COD saya sangat senang terimakasih shoope SMS Shoope Mantul Sale  Terimakasih ,terimakasih shoope aplikasi terperca se indonesia saya sudah kali memesa di shoope dan saya tidak perna kecewa saya telah memesan sprei sepatu pembatas buku  jas  sepatu sneakers perhiasan dll saya sangat senang kurirnya ramah bisa free ongkir dan cod saya sangat senang terimakasih shoope sms shoope mantul sale  terimakasih 
Shope mantab banget  sukak belanja di shopee  tapi knapa sampai saat ini aku belom dapet shopeepay later ,shope mantab banget  sukak belanja di shopee  tapi knapa sampai saat ini aku belom dapet shopeepay later 
Saya suka shopee krn cepat tanggapan nya apabila ada sesuatu yg di batalkan  dan bertanggung jawab  Dan kalau bisa tingkatkan lagi limit ongkir gratisnya sampai atau  kali sehari,saya suka shopee krn cepat tanggapan nya apabila ada sesuatu yg di batalkan  dan bertanggung jawab  dan kalau bisa tingkatkan lagi limit ongkir gratisnya sampai atau  kali sehari
Barang barang yg tidak ditemukan di app online shop sebelah semua nya ada disini  best lah shopee,barang barang yg tidak ditemukan di app online shop sebelah semua nya ada disini  best lah shopee
Saya sukanya untuk sistem pembayaranya  Jadi menahan sekali untuk agar tidak tertipu sama penjual,saya sukanya untuk sistem pembayaranya  jadi menahan sekali untuk agar tidak tertipu sama penjual
Banyak pilihan untuk belanja Online & banyak gratis ongkir nya  tapi melalui shopee pay & Spaylatter  Thaqs shopee,banyak pilihan untuk belanja online & banyak gratis ongkir nya  tapi melalui shopee pay & spaylatter  thaqs shopee
Aplikasi jelek jualan GK sesuai gambar r r r r r tapi boong Aplikasi sangat membantu untuk ber bisnis,aplikasi jelek jualan gk sesuai gambar r r r r r tapi boong aplikasi sangat membantu untuk ber bisnis
Aplikasi nya bagus  tidak hanya sekedar berbelanja namun dapat menghasilkan uang tanpa modal dengan fitur Shoope Tanam  banyak promo menariknya juga buruan download,aplikasi nya bagus  tidak hanya sekedar berbelanja namun dapat menghasilkan uang tanpa modal dengan fitur shoope tanam  banyak promo menariknya juga buruan download
Shopee adalah aplikasi yg cukup memuaskan bagi customernya  Krn menjadi jembatan antara penjual dan pembeli supaya mencegah terjadinya tindak penipuan  Memberikan diskon dan voucher cukup banyak  Semoga shopee kedepannya lebih sukses dan selalu menjadi kepuasan dalam penggunanya  Terima kasih,shopee adalah aplikasi yg cukup memuaskan bagi customernya  krn menjadi jembatan antara penjual dan pembeli supaya mencegah terjadinya tindak penipuan  memberikan diskon dan voucher cukup banyak  semoga shopee kedepannya lebih sukses dan selalu menjadi kepuasan dalam penggunanya  terima kasih
Utk saat ini pemakaiannya masih bagus dan normal nggak ada kendala  Semoga makin jaya buat shopee,utk saat ini pemakaiannya masih bagus dan normal nggak ada kendala  semoga makin jaya buat shopee
Shopee  % Aman dan amanah Soal harga terjangkau dan bisa bersaing di pasar manapun Shopee Murah Se indonesia raya dan shopee memberikan diskon besar besaran kalian hnya butuh kesabaran dan ketelitihan dalam memilih tokoh tokoh nya terimaksih bwt shopee telah memudahkan dan memberikan harga yang sangat Fantastis Murah  % Halal dan Aman Pokok nya barang saya di rumah Serba Dari Shopee karna murah nya dan kulitas original nya terjamin hemat hingga  % dari harga pasar biasa,shopee  % aman dan amanah soal harga terjangkau dan bisa bersaing di pasar manapun shopee murah se indonesia raya dan shopee memberikan diskon besar besaran kalian hnya butuh kesabaran dan ketelitihan dalam memilih tokoh tokoh nya terimaksih bwt shopee telah memudahkan dan memberikan harga yang sangat fantastis murah  % halal dan aman pokok nya barang saya di rumah serba dari shopee karna murah nya dan kulitas original nya terjamin hemat hingga  % dari harga pasar biasa
aplikasi belanja online yang paling terjangkau  banyak pilihan toko  juga banyak gratis ongkir  meskipun tidak cuma  sekarang  harus beli juga menggunakan shopee pay  tapi tetep jadi olshop pertama buat cari apa  di masa pandemik begini,aplikasi belanja online yang paling terjangkau  banyak pilihan toko  juga banyak gratis ongkir  meskipun tidak cuma  sekarang  harus beli juga menggunakan shopee pay  tapi tetep jadi olshop pertama buat cari apa  di masa pandemik begini
Aku beralih karena olshop yg warna ijo habis ada masalah dan di sini banyak gratis ongkir,aku beralih karena olshop yg warna ijo habis ada masalah dan di sini banyak gratis ongkir
Alhamdulillah ada shopee  bisa belanja nambah  rejeki  terimakasih shopee vochernya dtambah donk trs klu vocherx ndk bisa dgunakan tolong jgn upload percuma tdk bisa dpakai sekarang cashback juga mulai berkurang untuk vocher & cashbacknya udah tak seperti dulu,alhamdulillah ada shopee  bisa belanja nambah  rejeki  terimakasih shopee vochernya dtambah donk trs klu vocherx ndk bisa dgunakan tolong jgn upload percuma tdk bisa dpakai sekarang cashback juga mulai berkurang untuk vocher & cashbacknya udah tak seperti dulu
Shopee emang the best lah  Barang nya murah tapi ongkir nyaatapi the best lah apl nyaa,shopee emang the best lah  barang nya murah tapi ongkir nyaatapi the best lah apl nyaa
Puas pake Shopee Cuma koin ku sering kadaluarsa  Mau nya kan  gak usah pake expired,puas pake shopee cuma koin ku sering kadaluarsa  mau nya kan  gak usah pake expired
