cleansing,CaseFolding
MENTANG MENTANG PUNYA DUIT NARO IKLAN SEMBARANGAN TIAP MAIN GAME KETEMU IKLAN SHOPEE TERUS  WAKTU BROWSING BUKA WEB IKLAN LAGI  PAS LIAT YOUTUBE ADA LAGI IKLANNYA  BAHKAN PAS BUKA SITUS DEWASA MASI ADA IKLANNYA JUGA  ASTAGA PARAH BET DAH  SPAM IKLANNYA KAGA NGOTAK  Btw gua nginstall kaga buat belanja  cuman BIAR BISA KASI RATING BINTANG GEGARA IKLANNYA NYEBELIN GA BISA DI SKIP,mentang mentang punya duit naro iklan sembarangan tiap main game ketemu iklan shopee terus  waktu browsing buka web iklan lagi  pas liat youtube ada lagi iklannya  bahkan pas buka situs dewasa masi ada iklannya juga  astaga parah bet dah  spam iklannya kaga ngotak  btw gua nginstall kaga buat belanja  cuman biar bisa kasi rating bintang gegara iklannya nyebelin ga bisa di skip
Mohon maaf tapi saya sudah mencoba berkali kali tapi masi saja bisa masuk ,mohon maaf tapi saya sudah mencoba berkali kali tapi masi saja bisa masuk 
Shopee ku kok belum bisa berubah jadi shopee layter yaa  padahal udah aku perbarui aplikasinya,shopee ku kok belum bisa berubah jadi shopee layter yaa  padahal udah aku perbarui aplikasinya
Saya gabisa posting produk sih  centang centang atau kata selanjit nya ga tampil klo mau posting produk  huh,saya gabisa posting produk sih  centang centang atau kata selanjit nya ga tampil klo mau posting produk  huh
INI APLIKASI SUKA KELUAR AKUN SENDIRI  ALHASIL UANG SHOPEEPAY DAN KOIN GW ANGUS TANPA SEBAB  NYESESL  UDAH SERING GW BEGINI,ini aplikasi suka keluar akun sendiri  alhasil uang shopeepay dan koin gw angus tanpa sebab  nyesesl  udah sering gw begini
katanya untuk pengguna baru bisa dpt pulsa  rb tapi kok ngak bisa jdi males aku untuk donwload,katanya untuk pengguna baru bisa dpt pulsa  rb tapi kok ngak bisa jdi males aku untuk donwload
Kode pin shopeepay sangat mengganggu  Saran saya  gak usah pake kode pin Lama  gue uninstall ni shopee,kode pin shopeepay sangat mengganggu  saran saya  gak usah pake kode pin lama  gue uninstall ni shopee
Apa apaan sopi ini Min blanja  rp aja pake di jam jam segala  Mana pas mau klaim lemotnya minta ampun  Ga banget sopi sekarang makin ruwet Mbok ya dibikin seperti biasa tinggal klaim doang gitu lo biar ga nyusahin customer  Jd males belanja kalo gini mah Tolong diperbaiki sistem nya Parah,apa apaan sopi ini min blanja  rp aja pake di jam jam segala  mana pas mau klaim lemotnya minta ampun  ga banget sopi sekarang makin ruwet mbok ya dibikin seperti biasa tinggal klaim doang gitu lo biar ga nyusahin customer  jd males belanja kalo gini mah tolong diperbaiki sistem nya parah
gimana si aku udah daftar tapi kode nya engak di kirim kirim sama OTP shoppee bikin kesel aja biasana kan langsung di kirim,gimana si aku udah daftar tapi kode nya engak di kirim kirim sama otp shoppee bikin kesel aja biasana kan langsung di kirim
SAMPAH Mo balikin akun pake email susah bgt  no lama lupa Pake verifikasi email aj si buat mulihin kya yg lain Bantuan yg jawab mesin njrit,sampah mo balikin akun pake email susah bgt  no lama lupa pake verifikasi email aj si buat mulihin kya yg lain bantuan yg jawab mesin njrit
kenapa nggak bisa milih jasa kurirnya kecewa sekali,kenapa nggak bisa milih jasa kurirnya kecewa sekali
payah setiap ingin menggunakan spaylater selalu tidak bisa padahal tagihan sudah di bayar,payah setiap ingin menggunakan spaylater selalu tidak bisa padahal tagihan sudah di bayar
Emg sih semua serba ada dishopee  paling murah  juga harganya  Tapi makin kesini fitur  shopee semakin buruk dan gaenak  gratis ongkirnya sekarang ada jam  tertentunya  cashbacknya jg tertentu  doang gasemua toko  Beda banget sama shopee yg awal  dulu  lebih enak  Sumpah makin males pake shopee,emg sih semua serba ada dishopee  paling murah  juga harganya  tapi makin kesini fitur  shopee semakin buruk dan gaenak  gratis ongkirnya sekarang ada jam  tertentunya  cashbacknya jg tertentu  doang gasemua toko  beda banget sama shopee yg awal  dulu  lebih enak  sumpah makin males pake shopee
Aplikasi nya jelek banget cuma ada gambar perempuan bawa belanjaan doang ,aplikasi nya jelek banget cuma ada gambar perempuan bawa belanjaan doang 
Shopee makin lama parah bngt udah gx pernah ada voucer gratis ongkir COD malah biaya penanganan mahal banget semua voucer isi nya shopeepay gratis ongkir nya cuma berlaku di toko star&mall aja padahal di akun suami ada voucer minimal belaja  rb tp di akun saya gx ada,shopee makin lama parah bngt udah gx pernah ada voucer gratis ongkir cod malah biaya penanganan mahal banget semua voucer isi nya shopeepay gratis ongkir nya cuma berlaku di toko star&mall aja padahal di akun suami ada voucer minimal belaja  rb tp di akun saya gx ada
Kok suram menu shopeefood gak ada di menu shopee suda update tetep gak ada yg komen di ig shopeefood juga sama gak ada shopefood suram shopeefood,kok suram menu shopeefood gak ada di menu shopee suda update tetep gak ada yg komen di ig shopeefood juga sama gak ada shopefood suram shopeefood
pengaturan Map error tolong diperbaiki Kecamatan ny gk bisa dipilih Google map ny juga error Pdahal sudah sesuai dengan tata letak rumah saya Tapi tidak bisa dipilih,pengaturan map error tolong diperbaiki kecamatan ny gk bisa dipilih google map ny juga error pdahal sudah sesuai dengan tata letak rumah saya tapi tidak bisa dipilih
Gimana sih shopee dari tanggal February sampai sekrang gelang pesanan sya belum dtg  Gk jelas bgt nama tokonya tiki  Id Sumpah deh gk jelas sampe sekarang gk dtg  Buat kalian yg pesen tiki id jgn mau deh pembohong Dann di tegur ya buat shopee soalnya sering bgt barang dgn foto jauhh banget beda bagett  Jdi nyesel gitu download,gimana sih shopee dari tanggal february sampai sekrang gelang pesanan sya belum dtg  gk jelas bgt nama tokonya tiki  id sumpah deh gk jelas sampe sekarang gk dtg  buat kalian yg pesen tiki id jgn mau deh pembohong dann di tegur ya buat shopee soalnya sering bgt barang dgn foto jauhh banget beda bagett  jdi nyesel gitu download
Saya kecewa sama apk ini karena saya tidak bisa mendaftar  Dan kenapa apk nya sangat lola,saya kecewa sama apk ini karena saya tidak bisa mendaftar  dan kenapa apk nya sangat lola
Maaf bintang saja  Saya pengguna Shopee yg sudah lumayan lama  bahkan lebih suka Shopee dari lainnya  Tapi setelah di update ke versi yg sekarang  bukannya aplikasi tambah baik  malah tambah berantakan  Masa search di toko nya sudah gak bisa pencarian anda tidak tersedia Sudah begitu  pesan lebih dari saja  gak bisa Lho bagaimana ceritanya  Orang mau beli kok dibatasi sih  Ini di semua barang yg dijual,maaf bintang saja  saya pengguna shopee yg sudah lumayan lama  bahkan lebih suka shopee dari lainnya  tapi setelah di update ke versi yg sekarang  bukannya aplikasi tambah baik  malah tambah berantakan  masa search di toko nya sudah gak bisa pencarian anda tidak tersedia sudah begitu  pesan lebih dari saja  gak bisa lho bagaimana ceritanya  orang mau beli kok dibatasi sih  ini di semua barang yg dijual
Saya tidak bisa menggunakan paylaternya lagi sdh lama bgt sdh update sy tdk ada shopee food & fresh,saya tidak bisa menggunakan paylaternya lagi sdh lama bgt sdh update sy tdk ada shopee food & fresh
Tolong dong  sgera selesaikan masalah saya  yg tidak menerima kode OTP saat menambahkan rekening bank  sudah jam saya buat aduan  tak kunjung terselesaikan  cuma disuruh menunggu dan menunggu  Saldo saya lumayan yg ada di saldo penjual  Ga bisa saya tarik  Tolong selesaikan  Sudah bosan disuruh menunggu,tolong dong  sgera selesaikan masalah saya  yg tidak menerima kode otp saat menambahkan rekening bank  sudah jam saya buat aduan  tak kunjung terselesaikan  cuma disuruh menunggu dan menunggu  saldo saya lumayan yg ada di saldo penjual  ga bisa saya tarik  tolong selesaikan  sudah bosan disuruh menunggu
Aplikasi lambat di banding  *kp*ed  why  Saya mau bayar eror  selalu tampilannya terjadi kesalahan  coba lagi  ketika coba lagi  tetap saja tejadi kesalahan  Belanja online agar lebih mudah dan simple  kenapa jadi susah dan merepotkan  Please fix it  thx,aplikasi lambat di banding  *kp*ed  why  saya mau bayar eror  selalu tampilannya terjadi kesalahan  coba lagi  ketika coba lagi  tetap saja tejadi kesalahan  belanja online agar lebih mudah dan simple  kenapa jadi susah dan merepotkan  please fix it  thx
Kalau pesan dari luar negri masa iya lama banget pengiriman  selalu lebih dari hari dari estimasi waktu  Udh gitu jasa pengiriman gak jelas pakai apa  Di menu pengiriman standar tapi gak tau entak jasa mana yg dipakai,kalau pesan dari luar negri masa iya lama banget pengiriman  selalu lebih dari hari dari estimasi waktu  udh gitu jasa pengiriman gak jelas pakai apa  di menu pengiriman standar tapi gak tau entak jasa mana yg dipakai
Pliss lah Knp kode Verifikasi sy Tdk terkirim Sdh pakai segala Macam cara tpi tdk bisa  Pda hal email sma kata sandi sudah benar,pliss lah knp kode verifikasi sy tdk terkirim sdh pakai segala macam cara tpi tdk bisa  pda hal email sma kata sandi sudah benar
Sudah selesai taman shopee keterangan gratis  Ga taunya bayar pas di masukin keranjang  Pembohong  Bikin dosa aja nih  Mendingan lapak lain  Bulsit,sudah selesai taman shopee keterangan gratis  ga taunya bayar pas di masukin keranjang  pembohong  bikin dosa aja nih  mendingan lapak lain  bulsit
Sekarang saya turunkan lgi jadi bintang smpek saya dpet spaylater sma shopee pinjam  Mkasih  Knap sih skarang buka akun shopee jadi lelet gini buka apk lainnya aman  saja,sekarang saya turunkan lgi jadi bintang smpek saya dpet spaylater sma shopee pinjam  mkasih  knap sih skarang buka akun shopee jadi lelet gini buka apk lainnya aman  saja
Kecewa  duit raib di akun istri saya  saya melaporkan bahwa saya mau kena tipu dengan niat agar pihak shopee bisa membantu  malah akun istri saya kena blok  saldo shopee pay istri saya semua di rampok pihak shopee  Saran saya hati  kalian klo mo isi saldo di shoppe  mending klo ko belanja bayar langsung ke indomaret atau alfamart  jangan pernah top up alias isi saldo  nanti nasib kita sama  anda mau,kecewa  duit raib di akun istri saya  saya melaporkan bahwa saya mau kena tipu dengan niat agar pihak shopee bisa membantu  malah akun istri saya kena blok  saldo shopee pay istri saya semua di rampok pihak shopee  saran saya hati  kalian klo mo isi saldo di shoppe  mending klo ko belanja bayar langsung ke indomaret atau alfamart  jangan pernah top up alias isi saldo  nanti nasib kita sama  anda mau
Hai admin  saya sebagai seller kecewa karena semakin hari bukan malah semakin baik tapi performanya semakin menurun setelah di update  Permasalahan mulai dari kode otp gak masuk mengisi jasa ongkir gagal  terus pemberian solusi yang cuma itu  aja hapus cache restart hp blablabla dan gaada hasilnya  dll  Jadi gabisa jualan  Tolong diperbaiki lagi  dari pada yang pake shopee pindah ke lain hati  Kalau udah diperbaiki bakal dikasih bintang lagi,hai admin  saya sebagai seller kecewa karena semakin hari bukan malah semakin baik tapi performanya semakin menurun setelah di update  permasalahan mulai dari kode otp gak masuk mengisi jasa ongkir gagal  terus pemberian solusi yang cuma itu  aja hapus cache restart hp blablabla dan gaada hasilnya  dll  jadi gabisa jualan  tolong diperbaiki lagi  dari pada yang pake shopee pindah ke lain hati  kalau udah diperbaiki bakal dikasih bintang lagi
Market lintah ne  iklan  rb ga ad pun orderan masuk  yang bner aja ini market tai bner ne merusak ukm,market lintah ne  iklan  rb ga ad pun orderan masuk  yang bner aja ini market tai bner ne merusak ukm
Biyaya penanganan gila gilaan asu jadi  % ngebunuh dropship  kenapa matiin dropship pdahal kan mau dropshiper mau bukan ga ngaruh  selama semua pembeli membayar dan penjual di bayar,biyaya penanganan gila gilaan asu jadi  % ngebunuh dropship  kenapa matiin dropship pdahal kan mau dropshiper mau bukan ga ngaruh  selama semua pembeli membayar dan penjual di bayar
dulu voucher Ongkir & cashback bisa digunakan berbarengan  sekarang hanya pilih salah satu saja ,dulu voucher ongkir & cashback bisa digunakan berbarengan  sekarang hanya pilih salah satu saja 
Loading saat buka menu lain seperti hisap rokok batang sampai habis  lama banget,loading saat buka menu lain seperti hisap rokok batang sampai habis  lama banget
Pesan barang selama hari dan ada notifikasi bahwa paket sudah sampai di tangan saya tapi saya tidak sama sekali menerima barang tersebut kerabat dan orang terdekat juga tidak mengetahui nya yang saya ragukan pada akhirnya terjadi lebih efektif bayar di tempat dari pada pengiriman via Alfamart atau Atm jika barang tidak sampai kalo sistem COD maka uang kita juga aman dan tidak perlu melalui cara rumit seperti pembayaran via Alfamart atau Atm sekali lagi saya menyesal telah belanja di sini,pesan barang selama hari dan ada notifikasi bahwa paket sudah sampai di tangan saya tapi saya tidak sama sekali menerima barang tersebut kerabat dan orang terdekat juga tidak mengetahui nya yang saya ragukan pada akhirnya terjadi lebih efektif bayar di tempat dari pada pengiriman via alfamart atau atm jika barang tidak sampai kalo sistem cod maka uang kita juga aman dan tidak perlu melalui cara rumit seperti pembayaran via alfamart atau atm sekali lagi saya menyesal telah belanja di sini
Kecewa banget sekarang nggak bisa milih ekspedisi  dahlah pindah commerce lain aja,kecewa banget sekarang nggak bisa milih ekspedisi  dahlah pindah commerce lain aja
Saya udah Download tapi tetep gabisa setiap udah mau mesen disuruh masukin kode udah dimasukin tetep salah jadi males,saya udah download tapi tetep gabisa setiap udah mau mesen disuruh masukin kode udah dimasukin tetep salah jadi males
Katanya ada bonus instal pertama Mana Bohong lo  gua unistal aja,katanya ada bonus instal pertama mana bohong lo  gua unistal aja
Kembalikan ekspedisi yg dulu kami merasa kecewa karna ongkir makin mahal,kembalikan ekspedisi yg dulu kami merasa kecewa karna ongkir makin mahal
Kenapa saya tdk bisa login kode OTP nya gk masuk  trs aq coba lagy malah sistem mengalami ganguang mau nya aplikasi ni apa sih ngajak ribut apa gimana ni aplikasi,kenapa saya tdk bisa login kode otp nya gk masuk  trs aq coba lagy malah sistem mengalami ganguang mau nya aplikasi ni apa sih ngajak ribut apa gimana ni aplikasi
Gak suka sama fitur barunya shopee tentang jasa pengiriman mending balikin seperti yg dulu aja,gak suka sama fitur barunya shopee tentang jasa pengiriman mending balikin seperti yg dulu aja
Ko shope tambak jelek aja giliran udh nemu barang mau di beli anda tidak bida menambakan toko ini Gmna sya mau beli tambah ga jelas aja ni shope udhmah gratis ongkir nya ga prnah ada,ko shope tambak jelek aja giliran udh nemu barang mau di beli anda tidak bida menambakan toko ini gmna sya mau beli tambah ga jelas aja ni shope udhmah gratis ongkir nya ga prnah ada
Kenapa kalau di pc bisa login  tapi di aplikasi enggak bisa login selalu masalah jaringan,kenapa kalau di pc bisa login  tapi di aplikasi enggak bisa login selalu masalah jaringan
Pas nonton live klaim koin gagal terus padahal jaringan bagus banget  seakan mempersulit pengguna,pas nonton live klaim koin gagal terus padahal jaringan bagus banget  seakan mempersulit pengguna
Kembalikan hak kita untuk bisa memilih ekspedisi pengiriman Jangan egois donks,kembalikan hak kita untuk bisa memilih ekspedisi pengiriman jangan egois donks
Daftar sopee payleter gagal terus  di undur  trus  an gagal tah hapa salah nya jadi malas udah,daftar sopee payleter gagal terus  di undur  trus  an gagal tah hapa salah nya jadi malas udah
Aplikasi maling pembayaran angsuran kredit saya bulan belum masuk tapi di shopee dibilang berhasil mencoba komplain ke pihak CS chat saya selalu diakhiri dan ada yg menjawab tp tidak memuaskan maksutnya apa SHOPEE ini tolong kembalikan hak ORANG,aplikasi maling pembayaran angsuran kredit saya bulan belum masuk tapi di shopee dibilang berhasil mencoba komplain ke pihak cs chat saya selalu diakhiri dan ada yg menjawab tp tidak memuaskan maksutnya apa shopee ini tolong kembalikan hak orang
Sudah langganan  tetapiketika terjadi suatu masalah  sangat kecewa dengan hasil penyelesaian dari pihak shoopee  kecewa banget,sudah langganan  tetapiketika terjadi suatu masalah  sangat kecewa dengan hasil penyelesaian dari pihak shoopee  kecewa banget
gaenak sekarang gabisa piLih ekspedisi sendiri padahaL cuma  &  yg bisa diandaLkan cepat aman Langganan ekspedisi yg Lainnya pada gabut kaLi ya  pada protes ke shopee sedikit orderan TOLONG kembaLikan ekspedisi piLihan sendiri,gaenak sekarang gabisa pilih ekspedisi sendiri padahal cuma  &  yg bisa diandalkan cepat aman langganan ekspedisi yg lainnya pada gabut kali ya  pada protes ke shopee sedikit orderan tolong kembalikan ekspedisi pilihan sendiri
Ada biaya tersembunyi yang tidak transparan  dan jumlah nya lebih besar daripada biaya admin  dan itu langsung ditagihkan ke tagihan shopepay later tanpa konfirmasi  dan pemberitahuan sebelumnya  waspadalah Ayo kita tinggalkan Shopee,ada biaya tersembunyi yang tidak transparan  dan jumlah nya lebih besar daripada biaya admin  dan itu langsung ditagihkan ke tagihan shopepay later tanpa konfirmasi  dan pemberitahuan sebelumnya  waspadalah ayo kita tinggalkan shopee
Server nya makin down dan Bot Nya banyak kalau Flash Sale pasti kalah sama Bot  Dan emng gbs diharepin sih  ,server nya makin down dan bot nya banyak kalau flash sale pasti kalah sama bot  dan emng gbs diharepin sih  
Awalnya suka sekarang muak Shope semakin pelit  vocher muluk kenapa kalau punya akun lebih dari yang penting kan banyak yang ndonlowd kamu  shopee Sumpah makin muak akuu  kalau pengen pengguna akun hanya sering kasih voucher Biar nggak nyari nomor baru biar dapet Voucher pengguna baru  udah susah nyari nomor baru malah Tulisannya Voucher baca nih baca,awalnya suka sekarang muak shope semakin pelit  vocher muluk kenapa kalau punya akun lebih dari yang penting kan banyak yang ndonlowd kamu  shopee sumpah makin muak akuu  kalau pengen pengguna akun hanya sering kasih voucher biar nggak nyari nomor baru biar dapet voucher pengguna baru  udah susah nyari nomor baru malah tulisannya voucher baca nih baca
Akun saya tiba tiba terblokir aku tidak ada melakukan pelanggaran apapun mana tanggung jawabnya,akun saya tiba tiba terblokir aku tidak ada melakukan pelanggaran apapun mana tanggung jawabnya
Good job Tp sayang saya blm dpt paylater Pdhl sdh lama menggunakan shopee,good job tp sayang saya blm dpt paylater pdhl sdh lama menggunakan shopee
Flash sale  &  Flash voucher  serba konyol  Saat flash sale harga yang ditetapkan shopee sering kali malah lebih mahal dari harga jual toko tsb sesaat sebelum flash sale mulai  karena itu saya sarankan cek dahulu harga di toko sebelum flash sale mulai  Yang paling buruk adalah  flash voucher Dari pembelian menggunakan flash voucher dibatalkan toko dengan berbagai alasan  Dan bahkan yg dikirim  produk tidak ada yang sama dengan yang dibeli Saling lempar kesalahan  Mending TOKOPEDIA,flash sale  &  flash voucher  serba konyol  saat flash sale harga yang ditetapkan shopee sering kali malah lebih mahal dari harga jual toko tsb sesaat sebelum flash sale mulai  karena itu saya sarankan cek dahulu harga di toko sebelum flash sale mulai  yang paling buruk adalah  flash voucher dari pembelian menggunakan flash voucher dibatalkan toko dengan berbagai alasan  dan bahkan yg dikirim  produk tidak ada yang sama dengan yang dibeli saling lempar kesalahan  mending tokopedia
Gimana si  Saya udah ngadu permasalahan di akun shopee saya Tapi ga ada respon sama sekali Adminnya ngapain  Makan gaji buta  Ya Tuhan Akun saya tidak bisa menambahkan ongkos kirim sudah saya hapus cache logout jaringan ini itu hasilnya Zonk Tetap ga bisa buat ongkos kirim Pliss dong tolong,gimana si  saya udah ngadu permasalahan di akun shopee saya tapi ga ada respon sama sekali adminnya ngapain  makan gaji buta  ya tuhan akun saya tidak bisa menambahkan ongkos kirim sudah saya hapus cache logout jaringan ini itu hasilnya zonk tetap ga bisa buat ongkos kirim pliss dong tolong
Lucu gak bisa milih jasa pengiriman dan gak semua jasa pengiriman bagus  UNINSTALLSHOPEE,lucu gak bisa milih jasa pengiriman dan gak semua jasa pengiriman bagus  uninstallshopee
Harga barang %  rata  termahal blm jg ongkirny pun mahalnya minta ampun  di banding lazada jd malas blanja di shopi nol bintang seharusnya semua ulasan diaplikasi ini kebanykan bintang jelek bangt terlalu mahal ongkir  terlalu mahal produk yg di jual  padhl kebanykan yg bekas jg mau bilang gratis preketek barang di naikan lipat gratis dr mn gratis dr nenek moyang shopi lu,harga barang %  rata  termahal blm jg ongkirny pun mahalnya minta ampun  di banding lazada jd malas blanja di shopi nol bintang seharusnya semua ulasan diaplikasi ini kebanykan bintang jelek bangt terlalu mahal ongkir  terlalu mahal produk yg di jual  padhl kebanykan yg bekas jg mau bilang gratis preketek barang di naikan lipat gratis dr mn gratis dr nenek moyang shopi lu
aplikasi shopee berat lelet susah mau cari barang ga seperti aplikasi toko sebelah ringan gampang cari  barang ga pake lama,aplikasi shopee berat lelet susah mau cari barang ga seperti aplikasi toko sebelah ringan gampang cari  barang ga pake lama
Cukup buruk karna app cukup besar untuk data nya ditambah setiap buka app lemot banget,cukup buruk karna app cukup besar untuk data nya ditambah setiap buka app lemot banget
Udah berlangganan banget sama shopee sampe tahun baru sekarang saya kecewa banget Akun saya yg dulu gak bisa kembali lagi padahal saya sudah ajukan dan penuhi semua persyaratan untuk mengatasi akun dulu saya yg nomor telfon nya gak aktif lagi padahal di akun tsbt masih banyak saldo shopee pay dan belum sempet gua pake kecewwa sumpah,udah berlangganan banget sama shopee sampe tahun baru sekarang saya kecewa banget akun saya yg dulu gak bisa kembali lagi padahal saya sudah ajukan dan penuhi semua persyaratan untuk mengatasi akun dulu saya yg nomor telfon nya gak aktif lagi padahal di akun tsbt masih banyak saldo shopee pay dan belum sempet gua pake kecewwa sumpah
Buruk tidak bisa cod saat chekout padahal tertera di pengiriman bisa Hu,buruk tidak bisa cod saat chekout padahal tertera di pengiriman bisa hu
Tetangga sebelah rumah bisa shopee cod kenapa aku bisa Di menu pilih pembayaran bisa di klik,tetangga sebelah rumah bisa shopee cod kenapa aku bisa di menu pilih pembayaran bisa di klik
Biar bintang yang berbicara  Payah isi ulang saldo shoope pay dari kemarin belum masuk aja,biar bintang yang berbicara  payah isi ulang saldo shoope pay dari kemarin belum masuk aja
Shopee gak jelas di setiap event akhir  ini di promosi in dimana  free ongkir minimal Rp bla bla bla nyatanya kagak tetep aja kena ongkir misal kebetulan dapet barang flash sale kalo ujung nya kena ongkir mah males hitungan nya jadi mahal di ongkos ini penipuan php ya gak kayak tahun lalu kalo promo free ongkir tuh beneran free berapa pun harga barang nya gak kena ongkir sekarang mah ah sudahlah  mana cash back makin kecil ampun dah,shopee gak jelas di setiap event akhir  ini di promosi in dimana  free ongkir minimal rp bla bla bla nyatanya kagak tetep aja kena ongkir misal kebetulan dapet barang flash sale kalo ujung nya kena ongkir mah males hitungan nya jadi mahal di ongkos ini penipuan php ya gak kayak tahun lalu kalo promo free ongkir tuh beneran free berapa pun harga barang nya gak kena ongkir sekarang mah ah sudahlah  mana cash back makin kecil ampun dah
Khusus wilayah PAPUA BARAT KABUPATEN SORONG kelurahan mana saja yang mendukung pembayaran COD,khusus wilayah papua barat kabupaten sorong kelurahan mana saja yang mendukung pembayaran cod
Semakin lama semakin pelit  gratis ongkir kalo bisa yg biasa aja gk usah pake extra,semakin lama semakin pelit  gratis ongkir kalo bisa yg biasa aja gk usah pake extra
Baru mau download  gk jadi deh lihat kbnykan yg udah download komentar negatif  Bintang,baru mau download  gk jadi deh lihat kbnykan yg udah download komentar negatif  bintang
Shopee gimana sih Padahal saya baru belanja pakai Shopee  Dan senang sekali karena Shopee punya banyak promo menarik  Tapi pas saya mau Checkout malah ada masalah error BAGAIMANA  Sekarang saya tidak bisa belanja di Shopee,shopee gimana sih padahal saya baru belanja pakai shopee  dan senang sekali karena shopee punya banyak promo menarik  tapi pas saya mau checkout malah ada masalah error bagaimana  sekarang saya tidak bisa belanja di shopee
Parah  bolak balik ngincer flash sale ga dapet Masa iya blm detik barang sdh habis pc  Kalo enggk uda sold out msh pajang flash sale  Ini nipu mas mbak  kasian sama org awam yg sdh berharap tp mala tipu,parah  bolak balik ngincer flash sale ga dapet masa iya blm detik barang sdh habis pc  kalo enggk uda sold out msh pajang flash sale  ini nipu mas mbak  kasian sama org awam yg sdh berharap tp mala tipu
Aplikasi nya jadi lelet Ngeleg  Padahal sinyal ok Bikin malas belanja,aplikasi nya jadi lelet ngeleg  padahal sinyal ok bikin malas belanja
agak kecewa karna gk bs daftar spaylater  pdahal sdah sering transaksi di aplikasi ini,agak kecewa karna gk bs daftar spaylater  pdahal sdah sering transaksi di aplikasi ini
Ribet balikin saldo musti pakai verifikasi data segala  makanya identitas data kita sering dicuri disalahgunakan oleh pihak yang tidak bertanggung jawab Payah bintang only,ribet balikin saldo musti pakai verifikasi data segala  makanya identitas data kita sering dicuri disalahgunakan oleh pihak yang tidak bertanggung jawab payah bintang only
